{
  "$schema": "https://json-schema.org/draft/2020-12/schema",
  "$id": "https://pi-smart-router.dev/contracts/telemetry-contrib.schema.json",
  "title": "TelemetryContribRecord",
  "description": "Privacy-safe community telemetry contribution row (GitHub #67). Scalar routing features and outcome labels only — never prompt text, messages, request_id, or install-local pepper fields. SP-285 / #170 adds additive optional fields: row_id, prompt_length_chars, message_count, and opt-in embedding vectors (format version stays 2 — additive within-major).",
  "type": "object",
  "required": [
    "version",
    "timestamp",
    "session_id_hash",
    "turn_type",
    "reason_code",
    "selected_model_id",
    "routing_latency_ms"
  ],
  "additionalProperties": false,
  "properties": {
    "version": {
      "type": "integer",
      "const": 2,
      "description": "Contrib record format version. v2 (SP-250): session_id_hash is HMAC-SHA256 keyed with the install-local dataset pepper (was unsalted SHA-256 in v1)."
    },
    "timestamp": {
      "type": "string",
      "format": "date-time",
      "description": "ISO-8601 routing decision timestamp."
    },
    "session_id_hash": {
      "type": "string",
      "pattern": "^[a-f0-9]{64}$",
      "description": "One-way HMAC-SHA256 hash of session_id keyed with the install-local dataset pepper — stable per install, not correlatable across installs; raw session_id is never exported."
    },
    "row_id": {
      "type": "string",
      "pattern": "^[a-f0-9]{64}$",
      "description": "Stable privacy-safe row id (SP-285 / #170): HMAC-SHA256 of request_id keyed with the install-local dataset pepper and a 'row:' domain-separation prefix. Stable per install for aggregate dedup and reproducible training splits; not correlatable across installs. The raw request_id itself is never exported."
    },
    "turn_type": {
      "type": "string",
      "minLength": 1
    },
    "stage": {
      "type": "string",
      "minLength": 1
    },
    "reason_code": {
      "type": "string",
      "minLength": 1
    },
    "selected_model_id": {
      "type": "string",
      "minLength": 1
    },
    "tier": {
      "type": "string",
      "enum": ["zero-tier", "economical-cloud", "frontier-cloud"]
    },
    "routing_latency_ms": {
      "type": "number",
      "minimum": 0
    },
    "estimated_cost_usd": {
      "type": ["number", "null"],
      "minimum": 0
    },
    "estimated_input_tokens": {
      "type": ["integer", "null"],
      "minimum": 0
    },
    "prompt_length_chars": {
      "type": "integer",
      "minimum": 0,
      "description": "Character length of the routed prompt (count only, SP-285 / #170) — feeds the P(success) prompt_length feature and edit-distance proxies; previously dropped on this path, starving the feature to zero."
    },
    "message_count": {
      "type": "integer",
      "minimum": 0,
      "description": "Number of messages in the routing envelope (count only, SP-285 / #170)."
    },
    "embedding": {
      "type": ["array", "null"],
      "items": { "type": "number" },
      "minItems": 384,
      "maxItems": 384,
      "description": "Opt-in raw 384-dim encoder embedding of the metadata-prefixed routing input (SP-285 / #170) for hydra_projection training (floor >=100). Derived dense vector, never prompt text. Present only when SMART_ROUTER_DATASET_EMBEDDINGS=1 at capture time and the operator exported with --embeddings; absent otherwise."
    },
    "has_tool_context": {
      "type": "boolean"
    },
    "compaction_flag": {
      "type": "boolean"
    },
    "triage_verdict": {
      "type": ["string", "null"]
    },
    "triage_reason_code": {
      "type": ["string", "null"]
    },
    "triage_cyclomatic_score": {
      "type": ["number", "null"],
      "minimum": 0
    },
    "triage_trivial_hits": {
      "type": ["integer", "null"],
      "minimum": 0
    },
    "triage_complex_hits": {
      "type": ["integer", "null"],
      "minimum": 0
    },
    "triage_sanitized_length_delta": {
      "type": ["integer", "null"]
    },
    "requirement_reasoning": {
      "type": ["number", "null"],
      "minimum": 0,
      "maximum": 1
    },
    "requirement_code_gen": {
      "type": ["number", "null"],
      "minimum": 0,
      "maximum": 1
    },
    "requirement_tool_use": {
      "type": ["number", "null"],
      "minimum": 0,
      "maximum": 1
    },
    "cluster_id": {
      "type": ["string", "null"]
    },
    "cluster_similarity": {
      "type": ["number", "null"]
    },
    "cluster_margin": {
      "type": ["number", "null"]
    },
    "low_intensity_score": {
      "type": ["number", "null"]
    },
    "tier_hint": {
      "type": ["string", "null"],
      "enum": ["zero-tier", "economical-cloud", "frontier-cloud", null]
    },
    "p_success_cheap": {
      "type": ["number", "null"],
      "minimum": 0,
      "maximum": 1
    },
    "local_eligible_reason": {
      "type": ["string", "null"]
    },
    "tier_selection_reason_code": {
      "type": ["string", "null"]
    },
    "success_label": {
      "type": ["boolean", "null"],
      "description": "Derived outcome label when behavioral signals exist."
    },
    "outcome_signals": {
      "type": "array",
      "items": {
        "type": "string",
        "enum": [
          "model_override",
          "compaction_pin_break",
          "feedback_good",
          "feedback_bad",
          "tool_failure_chain",
          "stop_reason_invalid",
          "reprompt_detected",
          "high_edit_distance",
          "provider_failover",
          "stop_reason_length",
          "infra_error"
        ]
      }
    },
    "tool_failure_chain_count": {
      "type": ["integer", "null"],
      "minimum": 0,
      "description": "Consecutive identical tool failures at routing time (privacy-safe scalar)."
    },
    "stop_reason_invalid": {
      "type": ["boolean", "null"],
      "description": "True when provider stop_reason indicates invalid task completion."
    },
    "reprompt_rate": {
      "type": ["number", "null"],
      "minimum": 0,
      "maximum": 1,
      "description": "Normalized session re-prompt rate without storing prompt text."
    },
    "edit_distance_proxy": {
      "type": ["number", "null"],
      "minimum": 0,
      "maximum": 1,
      "description": "Normalized prompt-length delta proxy for edit/re-prompt detection."
    }
  }
}
